Text,Emoji_1,Emoji_2,Emoji_3,Emoji_4,Emoji_5,Pct_1,Pct_2,Pct_3,Pct_4,Pct_5
I do it for 5/6 times a week leh sad  and yes closing is damn fuck opening so much better,35,3,34,45,40,0.23164578,0.11787699,0.10741058,0.071775876,0.06737439
Who got to pen today man crying ,35,3,34,2,0,0.15008256,0.06526362,0.034028117,0.029023837,0.024308266
 still strict,35,45,20,25,19,0.1154548,0.10867516,0.07297888,0.05607822,0.046163283
i want to make waffles unhappy ,36,22,5,27,34,0.10477666,0.103031486,0.05490137,0.053530686,0.053400174
 had chopsuey before that unhappy  laughing my ass off humble feeds are always the bomb!,36,6,17,54,0,0.083522335,0.06711232,0.060428422,0.059966292,0.053667463
But i want unhappy  that looks so yummy hehehe.,36,49,4,54,16,0.098003626,0.078897834,0.059521504,0.054050118,0.05280582
did some warm up sketches of some of my faves,36,16,6,49,7,0.1498153,0.090881035,0.06030652,0.05686496,0.03784899
Too bad i can't watch it unhappy  that cake is cute and looks delicious,36,5,27,34,46,0.13899788,0.105932705,0.08788612,0.042599995,0.032204654
we can get pork katsudon at Tokyo Diner! Tho it doesn't have egg in it unhappy ,36,33,53,62,10,0.08100035,0.08071184,0.074658826,0.06487405,0.06392828
Pierces like a bitch unhappy ,37,32,26,56,55,0.123860136,0.109299265,0.06581048,0.06068003,0.058221143
fuck get me followers unhappy  my ratio is amazing,37,32,55,35,63,0.06475462,0.05977927,0.054889455,0.04614366,0.04583638
As if this process hasn't been frustrating enough,37,55,32,45,43,0.11878753,0.10646905,0.08463881,0.0740629,0.067539066
Hey Tony,38,50,16,9,36,0.14824814,0.1294563,0.09862405,0.08326274,0.07759097
It was not your fault,38,1,26,5,46,0.1539994,0.07219104,0.0565344,0.044619806,0.038623672
you're a kabute unhappy ,38,30,11,56,26,0.097883925,0.0636547,0.0609331,0.053525124,0.045201033
don't rt to save a guy's life ,38,56,25,1,19,0.09145418,0.08684311,0.076939985,0.068131566,0.06441412
Don kray denial of normal bi say ,38,0,49,11,25,0.049176097,0.048991483,0.045864124,0.042550623,0.04056193
 basketball etc theyre all restrict.Threw ,38,56,30,13,6,0.093039304,0.08491584,0.07463161,0.04822514,0.041553594
you don't post much lately?  school unhappy  ,38,56,22,1,55,0.08366059,0.059260394,0.051828884,0.050900962,0.044611618
just now I saw. But you did not reply unhappy ,38,1,55,25,19,0.26916802,0.08723098,0.074281484,0.0640739,0.044675473
Hi Julie,38,16,7,53,30,0.09608668,0.08357455,0.06826249,0.06242437,0.05978473
Mmmmm I guess your not getting much acting work these days? You have too much time on your hands unhappy ,38,55,1,56,22,0.1332051,0.11311182,0.09123681,0.07920703,0.06526165
 but how about yours? unhappy ,38,5,26,30,1,0.14032757,0.10419831,0.102318086,0.094906256,0.058702275
How unhappy  some dogs like it though,39,22,5,27,45,0.11237933,0.07162049,0.06533307,0.06502481,0.06310543
His face looks bloated unhappy  baby get well soon ,39,34,27,5,43,0.07098487,0.06793399,0.060508013,0.059654098,0.054161385
I keep waking up in the middle of the night sick as shit. unhappy ,39,27,5,43,52,0.11883609,0.101034306,0.0952324,0.08342797,0.07171302
i feel so sick today unhappy ,39,27,5,43,52,0.08659287,0.06592678,0.06496552,0.060628206,0.056584973
NMD R2's so ugly unhappy  ,39,52,46,35,34,0.084451504,0.06924511,0.06267011,0.052740198,0.052613094
I caught a cold. unhappy  It seems I've got tired than I expected....,39,27,43,35,52,0.15754351,0.075293094,0.04365293,0.04346157,0.036645953
 the girl in front of me was ,39,4,12,6,49,0.14424095,0.1005577,0.058482416,0.050138842,0.04959549
 it's such a negative pit of unhappiness,39,52,56,43,22,0.19594678,0.17125498,0.07667916,0.023367498,0.019727118
mom please stop making cookies,39,21,52,38,56,0.26593763,0.20773615,0.105841815,0.043887366,0.042394705
unhappy  :/ unhappy   feeling sick,39,27,5,43,52,0.14084469,0.0825016,0.06098713,0.05246334,0.03876045
Must Feel Like Shit When Men Can Stare Down The Barrel Of A Bong As They Spend Their Kid's Milk Money unhappy ,39,52,25,22,55,0.07630502,0.069381244,0.06067084,0.059740186,0.05048208
ohh normally I feel sick when I drink like 3-4 cups of coffee ,39,52,43,12,45,0.13428324,0.13184607,0.0704984,0.068483,0.05938181
 I have a cold unhappy  we'll see how I feel today!,39,52,43,27,5,0.061295923,0.05751402,0.054019216,0.05245289,0.04666841
and he's still taking over a quarter of the billboard charts while x is,40,6,33,42,17,0.054971404,0.05072853,0.045129806,0.044227224,0.042776972
For those asking,41,1,21,19,14,0.045162763,0.031519786,0.030726178,0.027244113,0.0271866
 but what camera you shooting with,41,42,12,22,25,0.14781739,0.10422242,0.06749442,0.05289167,0.051448803
Is that store still in use? If so,41,9,12,25,22,0.15111163,0.1191483,0.09455035,0.06673681,0.06393398
#NAME?,41,12,9,22,46,0.11172391,0.08947822,0.07869885,0.07183236,0.070246786
#NAME?,41,12,9,22,46,0.13136485,0.071294755,0.049864024,0.04664881,0.043653715
#NAME?,41,12,9,22,46,0.112391666,0.08375746,0.076673515,0.073723555,0.041989442
Oh boo,41,49,28,22,5,0.07512996,0.06941733,0.06599556,0.058385856,0.05698623
yes jenniessi? ,41,9,40,53,58,0.18677554,0.18332107,0.06927634,0.0669887,0.06608935
U4v9rr I wish I had noted the gentleman's name unhappy  but if you find out who he is,41,32,46,34,50,0.06792482,0.065778114,0.05814143,0.056185905,0.052638214
can just see the edge creeping in unhappy  ,41,52,12,62,43,0.10374248,0.094578244,0.07687038,0.06508145,0.058401696
PSA: REMEMBER THIS WHEN YOU ASK ARTISTS TO DRAW FOR YOU. I'd say the same thing for writers but apparently commissi ,41,20,22,62,25,0.2248126,0.19228007,0.09318636,0.077196784,0.06195918
Still NO sign - it's a very small area ( Gardens ) and it would be very obvious sad  quite a few eyes now ,41,22,27,34,5,0.08216939,0.06970441,0.062143087,0.03921322,0.0379753
 assumes Im outsider because of my ,41,46,42,14,49,0.14222242,0.12582424,0.11251746,0.094223015,0.07816007
 if i get 900 retweets and 900 likes. help me :(un,42,24,46,34,52,0.11433933,0.08338678,0.066663735,0.034050822,0.03364057
I can't access my school emails from any web browser unhappy  Yet I have so much homework for all my subjects on there,42,29,43,45,55,0.10134051,0.06664317,0.055638388,0.05531311,0.053800404
 if i get 900 retweets and 900 likes. help me :(un,42,24,46,34,52,0.19516417,0.16047291,0.08529098,0.07101303,0.060252983
i left my headphones at home unhappy  kms,42,3,29,51,19,0.07512997,0.06941732,0.06599555,0.058385868,0.056986246
 if i get 900 retweets and 900 likes. help me :(un,42,24,46,34,52,0.17085621,0.13643104,0.1264172,0.09469735,0.06876448
Call Duration: Before sex: 01:47:36 After sex: 00:00:19 crying ,42,46,34,25,52,0.10178066,0.07952989,0.074343294,0.059905298,0.055659696
shouldn't keep Kenyans complaining on ,42,1,48,37,14,0.040582236,0.03576211,0.03575963,0.033065867,0.032439437
Definitely my arms unhappy  ,43,27,5,52,45,0.06355789,0.060697597,0.060599457,0.050328404,0.047569588
fuckin' headache everyday unhappy ,43,52,45,27,32,0.10231459,0.06804486,0.06268799,0.05596969,0.047008343
Definitely my arms unhappy  ,43,27,5,52,45,0.080286376,0.05366194,0.050573297,0.04366021,0.04020939
Definitely my arms unhappy  ,43,27,5,52,45,0.15142387,0.13394861,0.09913559,0.076698646,0.07547517
Definitely my arms unhappy  ,43,27,5,52,45,0.11172391,0.08947822,0.07869885,0.07183236,0.070246786
Definitely my arms unhappy  ,43,27,5,52,45,0.08579525,0.078330144,0.07449382,0.07171293,0.0583601
Definitely my arms unhappy  ,43,27,5,52,45,0.24487604,0.08891144,0.08228235,0.066651575,0.0654746
Definitely my arms unhappy  ,43,27,5,52,45,0.10837476,0.104967095,0.09109831,0.070805065,0.054049727
Definitely my arms unhappy  ,43,27,5,52,45,0.15137766,0.112893485,0.08954236,0.07628495,0.05867099
Definitely my arms unhappy  ,43,27,5,52,45,0.103828505,0.08062608,0.064734295,0.05988889,0.056650348
Definitely my arms unhappy  ,43,27,5,52,45,0.07775156,0.07411255,0.070303954,0.0644262,0.062495288
Definitely my arms unhappy  ,43,27,5,52,45,0.059621442,0.050932594,0.044382405,0.04118894,0.03687615
Definitely my arms unhappy  ,43,27,5,52,45,0.15259124,0.11930649,0.117413215,0.07904811,0.07179376
Definitely my arms unhappy  ,43,27,5,52,45,0.07614307,0.05383043,0.043347616,0.042050686,0.03878288
Definitely my arms unhappy  ,43,27,5,52,45,0.04990227,0.049641315,0.048370082,0.04651662,0.045213945
Definitely my arms unhappy  ,43,27,5,52,45,0.058490034,0.057548266,0.055382054,0.040970456,0.03927826
Definitely my arms unhappy  ,43,27,5,52,45,0.15594845,0.13791513,0.08795865,0.08719856,0.05392803
In so much pain. My eye hurts unhappy  ,43,34,52,27,29,0.08180796,0.069643624,0.059837755,0.0576441,0.045529548
Definitely my arms unhappy  ,43,27,5,52,45,0.10903792,0.086428024,0.061407536,0.05066562,0.0446418
I have to wake up at 4:30 tomorrow so my body's gotten a head start by waking up at 4:30 every day this week unhappy ,43,27,42,52,45,0.14733952,0.13786642,0.12304982,0.09119367,0.07889965
when i'm enlisting can please turn up like this unhappy  ,44,48,11,37,13,0.08703963,0.05765693,0.049946837,0.04498377,0.042346038
 he'll kil ,44,0,9,42,51,0.0809173,0.08088563,0.07071001,0.05916367,0.048355807
Late nights ,44,48,14,63,6,0.120305374,0.08064584,0.0693897,0.046731662,0.038232435
4/20 today,44,57,17,40,31,0.21217494,0.099969715,0.08132015,0.0765218,0.05563966
only pure evil people unhappy ,44,13,32,55,15,0.07133492,0.06930786,0.05829891,0.046989515,0.046933442
only pure evil people unhappy ,44,13,32,55,15,0.089575216,0.087316066,0.07470949,0.06565493,0.054909617
White genocide is not a thing. Its figment of your imagination. Youre a victim of nothing but disinformation. ,44,11,58,39,56,0.11417119,0.108192205,0.053838927,0.052716337,0.047161452
only take season 9 off ,44,57,42,37,31,0.20844771,0.100361474,0.09619005,0.0859979,0.07813375
Biggest problem for paper books is storage unhappy ,45,27,22,43,35,0.091408685,0.086565815,0.08320268,0.0706832,0.07055573
Does anyone have a 7 adapter or 7 earbuds i can borrow for the day? Left mine in my car unhappy ,45,43,29,22,27,0.0637477,0.05201546,0.05151705,0.047442026,0.0450724
 i don't think i'll be ever to edit long videos here unhappy  i'll go try another editing software ,45,34,22,20,35,0.072009526,0.06177132,0.060945354,0.055199824,0.045623228
honestly college makes me want to curl up into a ball and cry for 3 days straight unhappy ,45,27,34,5,35,0.13355917,0.109140664,0.06606932,0.051319104,0.04873316
When can you notice me.  unhappy  what?  ,46,27,5,22,34,0.11903989,0.118067116,0.09126663,0.08456261,0.055604193
Not you again sad  ,46,27,5,34,35,0.06741439,0.061940286,0.060041286,0.053432167,0.052971955
Missing in crying  Seaside area. ,46,34,35,5,27,0.11187727,0.11087679,0.102484584,0.100580804,0.09807371
Feel like i shoyould be telling you to get the fuck out social media byout also feel really mean because unhappy  silence  love yoyou hope yoyoure okay ,46,27,34,5,22,0.044072993,0.037035912,0.03374112,0.03343399,0.030097025
i miss you huhu so busy unhappy ,46,27,34,5,43,0.0349681,0.029925779,0.029243082,0.028575862,0.02764387
Help... I want to stop tweeting. All I feel is endless suffering and pain. I tried to deactivate myself many times... Save me... unhappy ,46,34,27,5,43,0.17409632,0.124034055,0.08753347,0.08408939,0.07399418
When will you say hi sunshine ? unhappy  ,46,5,27,34,43,0.11307394,0.049175475,0.04569229,0.042828344,0.03966093
crying  muh feels,46,3,34,35,45,0.25922683,0.09031143,0.05370135,0.042758476,0.04197779
 I sincerely hope not too many priceless antiques were destroyed. Reg ,46,62,12,34,57,0.0754691,0.073471844,0.069681786,0.042257793,0.038884033
 can't believe he will be year for next year unhappy  We're becoming old HAHAHAH :v,46,28,34,49,5,0.12232387,0.11646321,0.082918406,0.080659665,0.07497545
I seriously thought that Coldplay was going to be band like Depeche Mode or U2,46,3,34,12,35,0.09655951,0.07671502,0.045831062,0.045454044,0.045079563
Yuri was here and i didn't know it unhappy  the second snsd i missed ,46,34,3,27,5,0.14781739,0.10422242,0.06749442,0.05289167,0.051448803
Puta I know sorry isn't enough pero sorry padin unhappy ,46,27,34,5,45,0.10346146,0.08795109,0.0855444,0.061543234,0.05442261
 he can't leave us unhappy ,46,5,15,9,54,0.11237931,0.07162051,0.06533307,0.06502487,0.06310542
it hurts me to see him so sad unhappy  you don't understand i have to do this. if i don't kill you,46,42,34,5,27,0.11237931,0.07162051,0.06533307,0.06502487,0.06310542
When your online crush comes to the meet-up without their Snapchat filter unhappy  ,46,34,45,19,35,0.11408104,0.09089685,0.073480844,0.055203483,0.03314099
HAPPY BIRTHDAY KATRIKA  I miss you though unhappy  miss having you in our group and all haih  anyway,46,34,5,35,27,0.15503135,0.14611012,0.08531174,0.0756099,0.052351072
I miss my dogs too unhappy ,46,5,27,34,35,0.1251324,0.11478777,0.10493424,0.103736684,0.055943828
ugh i miss my baby crying ,46,34,35,5,45,0.06067212,0.059691627,0.056344453,0.053725142,0.05264404
it's only been a few days since their promotion ended but i'm already missing her so much unhappy  ,46,34,5,27,45,0.07143395,0.04593375,0.045036215,0.042030863,0.034166727
it's only been a few days since their promotion ended but i'm already missing her so much unhappy  ,46,34,5,27,45,0.27484128,0.10316549,0.04987282,0.037097152,0.021604054
Ouch Elena Eremina's foot slip,46,52,34,43,45,0.2002495,0.079663016,0.06589147,0.050884966,0.045366935
Every time Meredith has flashbacks of Derek Shepherd I can't hold back the tears unhappy ,46,34,3,35,45,0.089026704,0.081942104,0.069782265,0.06763316,0.06472947
When your online crush comes to the meet-up without their Snapchat filter unhappy  ,46,34,45,19,35,0.11095447,0.08157062,0.07788982,0.05882896,0.054785848
whaaaaaaaat!!! You and unhappy  ,46,34,27,5,55,0.10332862,0.079287395,0.06841696,0.050058275,0.048130702
I miss snsd. I miss my girls unhappy ,46,34,5,27,35,0.1402488,0.096985444,0.052906845,0.036460217,0.032904305
clay and hannah   - they were so in love they deserved to be endgame unhappy  ,46,34,5,22,27,0.08893361,0.07218871,0.06685063,0.058878165,0.05652458
please talk to me about nct instant message lonely i need to fangirl once in a while okay crying ,46,3,34,35,45,0.0844515,0.069245115,0.06267011,0.052740198,0.0526131
i'd rather be sailor uranus but chibiusa but if thats everyone says i am unhappy  rip,46,34,5,27,35,0.10514682,0.068347506,0.05214063,0.05096616,0.04509846
The most painful goodbyes are the onesthat are never said and never explained crying  unhappy  :/,46,34,27,45,5,0.15969452,0.07023958,0.069045424,0.061476234,0.05011731
I lost two streaks and it's from my two favorite people silence  unhappy  good night,46,5,35,34,27,0.23111802,0.15035327,0.067414224,0.04612262,0.039363693
realized i havent eaten rice maghapon because i finished 3 packs of spicy seafood noodles + to  extra big chilimansi :(acid attack right now,46,34,52,45,43,0.059989065,0.055742234,0.0514039,0.03848795,0.037130326
i stayed 3 hours on the phone with aD my bubbyyyyyyy i miss her unhappy ,46,34,5,27,35,0.082435384,0.041129794,0.028896153,0.028721184,0.028336134
truuuu!! si grim reaper and sunny huhu grabe love story nila unhappy ,46,34,3,27,18,0.11036447,0.04900272,0.043603178,0.036803428,0.034570523
i miss hoseok unhappy  ,46,5,27,34,35,0.051068217,0.045585323,0.04132545,0.039979585,0.03918377
She loved Beth so much unhappy ,46,34,5,35,27,0.04992276,0.046117865,0.045729116,0.04293502,0.041492213
prince baekhyun.....throw me into the dungeon please i don't deserve to see your beautiful face unhappy ,46,34,3,27,5,0.057505764,0.05055263,0.04969992,0.04913238,0.04708716
Can't :(Tello,46,34,24,35,43,0.14781739,0.10422242,0.06749442,0.052891687,0.051448807
I miss Temperance Brennan and Seeley Booth so much unhappy ,46,34,27,5,35,0.08872298,0.08086101,0.07980403,0.07869422,0.07217864
it's only been a few days since their promotion ended but i'm already missing her so much unhappy  ,46,34,5,27,45,0.096165136,0.078268595,0.0720296,0.059387825,0.05792063
BES RIP  ,46,34,21,35,3,0.06047064,0.052312084,0.04294977,0.041582976,0.0413554
I'll be attending cosmic latte on saturday and i'll give these out to selu shippers KASI SELU MONTH QAQO unhappy  ,46,34,27,20,5,0.12244236,0.12226737,0.08724572,0.07942724,0.07771882
friendly fire to wings tour unhappy ,46,27,34,5,35,0.11172391,0.08947822,0.07869885,0.07183236,0.070246786
Someone build house on (4) i cant do it unhappy  cant believe this hasn't already been done????,46,34,3,27,29,0.07227867,0.062281303,0.051335864,0.050830297,0.041254174
tulips are my favorite unhappy  ,46,5,27,34,22,0.06276117,0.042443965,0.04092722,0.04022237,0.03703076
please reading this breaks my heart unhappy ,46,5,34,27,45,0.07512997,0.06941732,0.06599555,0.058385868,0.056986246
My moms leaving today to go out of town and I already miss her unhappy ,46,5,34,27,45,0.11311843,0.060719267,0.059334967,0.038805936,0.035575688
When your online crush comes to the meet-up without their Snapchat filter unhappy  ,46,34,45,19,35,0.06302064,0.054159172,0.05011659,0.048961613,0.040823586
the saddest part of my day everyday is when ryan has to leave at 5:30 am unhappy ,46,34,27,5,45,0.0576323,0.05394348,0.04505878,0.044907097,0.040682644
Wth why did 4/20 have to happen during the Easter holidays it's one of the best days in Leeds unhappy ,46,34,27,55,5,0.10241349,0.09288589,0.04806114,0.046027046,0.040587015
hakyeon turns 27 soon oh my god no he's still a baby unhappy ,46,34,3,45,35,0.11639334,0.055575013,0.047321234,0.04246791,0.04091157
Yesterday's faci so cute! But he 30+ :(Today's faci is old eeyer,46,34,24,47,27,0.11859871,0.08461553,0.0836581,0.07993855,0.048354253
I WAITED FOR U unhappy ,46,5,27,35,22,0.10098737,0.09086235,0.07274893,0.06516752,0.06006985
one direction (band)  whats going on unhappy ,46,34,48,11,27,0.07384405,0.071449295,0.06857888,0.06182668,0.06171208
my heart unhappy  ,46,27,5,45,35,0.21109158,0.17303908,0.08387431,0.0632508,0.056539744
My heart hurts. sad  I hate people ,46,27,5,35,34,0.078648,0.059502073,0.05893552,0.0526615,0.04772771
I suddenly miss you ate unhappy ,46,27,5,34,43,0.103869036,0.09869667,0.07724492,0.052349396,0.052169155
jungkook looks like he gives the biggest and warmest hugs unhappy  ,46,34,27,5,22,0.118922934,0.10363204,0.09738487,0.069953516,0.06321212
I miss you Levi unhappy ,46,27,5,34,35,0.09920946,0.09856308,0.075893305,0.061744493,0.05833681
When your online crush comes to the meet-up without their Snapchat filter unhappy  ,46,34,45,19,35,0.08352091,0.06963736,0.06511973,0.055633076,0.05199014
Guess who's not getting a unicorn frappuccino because they're sold out unhappy ,46,5,32,55,1,0.22467965,0.07003772,0.06348713,0.06023634,0.05963263
come back callie  gabbie d ghost unhappy  i love you both,46,34,3,5,27,0.050747108,0.046814296,0.04142114,0.030538993,0.030158706
Guess who's not getting a unicorn frappuccino because they're sold out unhappy ,46,5,32,55,1,0.07248254,0.062012687,0.058376476,0.05399163,0.02987647
why can't dogs just live forever unhappy ,46,5,27,34,45,0.09644495,0.09000298,0.076032594,0.065660544,0.0497105
I miss London already unhappy ,46,5,27,34,35,0.09321705,0.06399509,0.05511259,0.041350994,0.041106723
I miss you more unhappy ,46,5,27,34,35,0.34969586,0.12535568,0.07299505,0.048783973,0.04875936
this song will always be one of my faves unhappy  ,46,5,34,27,35,0.1989325,0.07312259,0.04955216,0.043760892,0.038128845
[thinks about how tfp soundwave is forever trapped in the void realm] unhappy ,46,27,34,22,5,0.19310807,0.14802423,0.07248009,0.06259425,0.061443824
the anniversary of josh's death unhappy ,46,34,5,27,35,0.19111457,0.14785732,0.097359814,0.09060349,0.0691228
Preacher...... unhappy ,46,27,5,21,35,0.08464773,0.07746991,0.06315094,0.04403051,0.041339908
yoongi come back unhappy ,46,34,3,27,35,0.12354942,0.080059156,0.0781269,0.057319578,0.04862673
most painful thing ever is having feelings for someone you can't be with .. unhappy ,46,5,27,43,45,0.068475045,0.06630217,0.05730392,0.05655915,0.05211553
mayes unhappy  .g,46,35,27,34,5,0.08795117,0.07632016,0.06917587,0.058744863,0.053862046
Ye... I will miss you unhappy ,46,34,27,5,35,0.12835513,0.106386766,0.09877183,0.09641683,0.092221595
jungkook looks like he gives the biggest and warmest hugs unhappy  ,46,34,27,5,22,0.102643736,0.0947722,0.08042923,0.07296805,0.048881058
babies unhappy  ,46,5,34,27,22,0.06047064,0.052312084,0.04294977,0.041582976,0.0413554
 I know I'm not ready to say goodbye unhappy  So,46,5,27,34,35,0.10074083,0.09227911,0.07831506,0.05081027,0.04889543
Never want to finish desperate housewives what will I do with my life unhappy ,46,56,34,29,5,0.056892116,0.04622558,0.042185817,0.036642853,0.036577377
how about me bes jup unhappy ,46,34,27,35,5,0.12140662,0.10363863,0.081869386,0.07246994,0.05456786
Andy unhappy  ,46,27,5,34,22,0.07512996,0.06941733,0.06599556,0.058385856,0.05698623
Okay lang friend promise meant to be broken =( HAHAHAHA,46,58,57,42,0,0.044201832,0.04211448,0.036525417,0.034667186,0.03461274
I MISSED YOU A WHOLE LOT unhappy  ,46,5,27,35,15,0.07159796,0.06468076,0.06268371,0.061713245,0.06097707
red velvet too unhappy  ,46,27,34,35,5,0.13355917,0.109140664,0.06606932,0.051319104,0.04873316
When will 2NE1 reunite unhappy ,46,34,27,5,35,0.08086051,0.07219163,0.060600825,0.05137665,0.047809124
  3 3 3 please unhappy  ,46,34,27,5,21,0.21103103,0.17285703,0.0694788,0.068769544,0.06216589
I miss you crying ,46,34,48,35,5,0.14414643,0.09556399,0.07750146,0.073853485,0.05500844
Huhu so lucky unhappy ,46,34,3,27,35,0.14816456,0.12054918,0.12003862,0.09756677,0.08550387
In memoriam of Alea Starbridge unhappy  Your beautiful voice will never be forgotten. ,46,34,24,8,47,0.091408074,0.09136354,0.06464314,0.06356587,0.05764997
I miss him so much unhappy ,46,5,27,34,35,0.14781739,0.10422242,0.06749442,0.05289167,0.051448803
I miss Temperance Brennan and Seeley Booth so much unhappy ,46,34,27,5,35,0.1630571,0.12734741,0.1182316,0.0733441,0.055520248
June 5 - June 16 unhappy  ,46,27,5,34,35,0.077559315,0.06749735,0.05240448,0.048263833,0.045138005
[thinks about how tfp soundwave is forever trapped in the void realm] unhappy ,46,27,34,22,5,0.07512996,0.06941733,0.06599556,0.058385856,0.05698623
32- for the love of a daughter crying  ,46,34,35,3,5,0.07116951,0.050283313,0.0420119,0.038741603,0.03711585
I'm so tired of pretending I'm not falling for you unhappy ,46,5,27,35,11,0.1251324,0.11478777,0.10493424,0.103736684,0.055943828
WUT I TOTALLY MISSED YOUR BDAY unhappy  Happy belated Birthday sweetheart,46,23,34,60,59,0.10569303,0.09395694,0.06733881,0.060402058,0.06013966
.I can't believe this hasn't been fixed yet,46,34,5,27,45,0.2482858,0.1135936,0.07741926,0.05263347,0.046557594
aw younhappy  i miss you too ,46,34,5,27,3,0.14621587,0.13944714,0.1239634,0.101759434,0.069564976
why am i not in aus with alisha unhappy  imagine the things we could be doing,46,29,34,3,2,0.06047064,0.052312084,0.04294977,0.041582976,0.0413554
I miss Temperance Brennan and Seeley Booth so much unhappy ,46,34,27,5,35,0.13366646,0.105428234,0.09487419,0.053995814,0.047111757
I love them with all my hort unhappy  ,47,8,18,59,60,0.10124004,0.09593487,0.08818423,0.06999436,0.060895186
The manifesto,48,6,11,4,24,0.11812129,0.04541872,0.044542454,0.04365234,0.042350236
EDM pleaseeeeeeeee   unhappy ,48,11,46,27,5,0.09719406,0.076641634,0.07588297,0.07490989,0.07425942
Oo crying  // Happy3YearsBraceUnited,48,11,4,18,61,0.12937929,0.101982266,0.08784008,0.08710987,0.048634287
 it's Adore you  ,48,11,18,24,61,0.102694444,0.08328316,0.049557324,0.046105947,0.043343887
tell me unhappy  why,48,46,27,11,5,0.084451504,0.06924511,0.06267011,0.052740198,0.052613094
sounds family ,48,6,11,13,41,0.12361088,0.09762019,0.093942866,0.08320397,0.07993827
I think that's one of the hottest part of your body  ,48,11,9,50,4,0.2095798,0.061374724,0.04591213,0.041363478,0.035076283
Umma why you do this crying ,48,34,46,11,35,0.08688834,0.07916241,0.073905185,0.069089465,0.060763307
Ravel Morrison unhappy  ,48,11,46,27,34,0.10112294,0.091291875,0.066080324,0.03288384,0.03117973
we left it all unspoken,48,11,46,35,5,0.065625176,0.057232607,0.052924436,0.050136752,0.05010153
Dear attendees,48,11,24,47,6,0.056789275,0.041858483,0.0406344,0.035107702,0.03461351
Got a msg! Oops not you unhappy ,49,26,50,62,54,0.10090037,0.09481062,0.09310944,0.05458509,0.049793787
I could write paragraphs about it xDShame its theoretically impossible in real life unhappy ,49,13,15,26,28,0.07512996,0.06941733,0.06599556,0.058385856,0.05698623
oh my god same! we should attend on some lessons together sometime just kidding HAHAH ,50,53,54,0,9,0.1182679,0.11455747,0.07995428,0.07612255,0.07010894
Left few months in HinHua ler unhappy  I need to gambateh wink  ,50,34,46,27,5,0.08475792,0.06309066,0.049643837,0.048240133,0.045518123
unhappy  they look dead,51,27,34,22,5,0.084451504,0.06924511,0.06267011,0.052740198,0.052613094
he was talking with the girl behind jin unhappy ,51,0,3,34,46,0.108063206,0.09458639,0.06719448,0.05962207,0.056775782
unhappy  i saw somebody said his hair fell out and bighit trying to figure it out,51,22,25,19,0,0.0910713,0.048816275,0.044975508,0.038790014,0.03835132
Rl? Serius? ,51,41,46,25,22,0.060829986,0.05805102,0.049233295,0.043753676,0.043061715
my braces hurt unhappy ,52,5,43,27,22,0.102420785,0.09941318,0.05052731,0.042033304,0.039375223
Q2 I'm not an MH healthcare professional. As much as I want to help I'm scared to death I might make the situation ,52,43,22,45,62,0.14375263,0.09943661,0.09510997,0.066291034,0.059948284
I cringed so hard :(That fall was such a shame- she had been looking really good until that point...,52,43,39,46,29,0.13355917,0.109140664,0.06606932,0.051319104,0.04873316
I'm scared unhappy  I mean. Why the heck did I decide to do laundry at 7:30 pm? What is wrong with me. Did I mention how dark it is. FML,52,43,42,29,45,0.14758705,0.13179317,0.061975703,0.057077307,0.055433337
